ТИП,ВОПРОС,ОТВЕТ,КОНТЕКСТ
простой,Как создавать и редактировать папки в приложении VK Мессенджер?,"Для создания и редактирования папок в приложении VK Мессенджер следуйте этим шагам:
Создание папки:
Откройте приложение VK Мессенджер.
Перейдите на вкладку ""Аккаунт"".
Выберите пункт ""Папки"".
Нажмите на кнопку ""Создать"".
Укажите название папки и выберите чаты или контакты, которые хотите добавить в эту папку.
Редактирование папок:

Для редактирования папок откройте меню с настройками папки. Это можно сделать, зажав фильтр ""Все"".
Для изменения порядка папок в списке зажмите любую из них и переместите вверх или вниз.
Чтобы добавить или удалить чат из папки, откройте папку, зажмите чат и выберите соответствующий вариант (""Добавить в папку"" или ""Убрать из папки"").
","Вы можете создать до 15 папок и добавить в них групповые чаты, диалоги с друзьями и контактами из телефонной книги. Откройте вкладку Аккаунт, выберите пункт Папки и нажмите Создать. Затем укажите название папки, выберите чаты и контакты.Чтобы добавить в папку чат из общего списка, зажмите его и выберите из открывшегося меню Добавить в папку. Чтобы удалить чат из папки, откройте её, зажмите чат и выберите Убрать из папки.Вы можете редактировать папки: меню с настройками откроется по долгому нажатию на фильтр Все. Для изменения порядка папок в списке зажмите любую из них и сдвиньте её вверх или вниз.В счётчике рядом с названием папки вы увидите количество непрочитанных сообщений во всех чатах выбранной папки, включая чаты с выключёнными уведомлениями. Если непрочитанные сообщения в папке находятся только в чатах с выключенными уведомлениями, счётчик будет серым. При наличии непрочитанных сообщений в чатах с включёнными уведомлениями — синим."
простой,Где находятся записи звонков?,"Записи звонков в ВКонтакте можно найти следующим образом:

От имени вашего профиля ВКонтакте: Если вы вели запись от своего профиля, сохранённые звонки будут доступны в разделе Мои видео в плейлисте «Трансляции звонков».

От имени сообщества: Если трансляция была проведена от имени сообщества, запись звонка появится в соответствующем разделе сообщества.","Если вы вели запись от имени своего профиля ВКонтакте, то сохранённые звонки будут доступны в разделе [https://vk.com/video|Мои видео] в плейлисте «Трансляции звонков». Если трансляция была от имени сообщества, то видеозапись появится в соответствующем разделе сообщества.Чтобы просмотреть записи звонков в приложении VK Звонки, выберите опцию Настройки и откройте список записей звонков. В нём отображаются все записи, в которых вы были инициатором. Нажмите на нужную запись — она автоматически откроется в новом окне браузера. Варианты действий, доступных с записью, расположены под видео."
простой,Есть ли комиссия за перевод другому пользователю VK Pay?,За переводы со счёта или карты VK Pay на счёт или карту VK Pay комиссия не взимается.,За переводы со счёта или карты VK Pay на счёт или карту VK Pay комиссия не взимается.
условный,"Что делать, если мне угрожают?","Если в ваш адрес поступают сообщения с оскорблениями и угрозами, отправьте жалобу на профиль пользователя и добавьте его в чёрный список. Эти действия помогут на время блокировать действия обидчика на нашей платформе. Если вам прислали угрозу физической расправы, рекомендуем как можно скорее обратиться в полицию. Подать обращение можно дистанционно на сайте МВД РФ",
простой,Как управлять бонусами?,"Вы можете выбрать, потратить или накопить бонусы, в момент онлайн-покупки. Для этого при оплате нажмите на стрелочку возле бонусного баланса и выберите нужное действие.Если у вас нет бонусов, они будут накапливаться по умолчанию. После пополнения бонусного баланса переключатель вернётся в то положение, которое вы ранее выбрали в мини-приложении VK Pay.","Вы можете выбрать, потратить или накопить бонусы, в момент онлайн-покупки. Для этого при оплате нажмите на стрелочку возле бонусного баланса и выберите нужное действие. {|nomargin:|-! <center>[[photo100_461983857|180x350pxnoborder| ]][[photo100_461983860|350x257pxnoborder| ]]</center>|}Если у вас нет бонусов, они будут накапливаться по умолчанию. После пополнения бонусного баланса переключатель вернётся в то положение, которое вы ранее выбрали в мини-приложении VK Pay."
простой,Что такое pin-код VK play,По сути это пинкод банковской карты. Вы сами придумываете PIN-код VK Pay при создании аккаунта VK Pay и используете его для подтверждения оплаты.,"Да, это один и тот же пароль. Вы сами придумываете PIN-код VK Pay при создании аккаунта VK Pay и используете его для подтверждения оплаты."
простой,Как отметить человека в истории?,"Чтобы вставить в историю упоминание, нажмите на значок стикера и выберите нужный. В качестве имени нужно ввести данные пользователя.","Чтобы вставить в историю упоминание, нажмите на значок стикера и выберите нужный. В качестве имени нужно ввести данные пользователя или адрес сообщества. Выпадающие подсказки помогут определиться. В одной истории может быть не более 10 упоминаний. Упомянутые получат оповещение.В мобильном приложении можно упомянуть пользователя с помощью значка @ в тексте — без стикера. Сообщества могут отключить такие упоминания в полной версии платформы: колокольчик → Настройки → под разделом Уведомления выбрать нужное сообщество → пункт Упоминания в историях. В мобильном приложении ВКонтакте: колокольчик → иконка настроек → Уведомления от сообществ → выбрать нужное сообщество → пункт Упоминания в историях."
простой,У кого я в черном списке?,"Возможности увидеть список пользователей, которые предпочли ограничить вам доступ к своему профилю, нет. Если вы зайдете в такой профиль, то рядом с главной фотографией будет надпись «Пользователь ограничил доступ к своей странице».","Увы, возможности увидеть список пользователей, которые предпочли ограничить вам доступ к своему профилю, нет. Если вы зайдете в такой профиль, то рядом с главной фотографией будет надпись «Пользователь ограничил доступ к своей странице»."
простой,Как удалить подписчика?,"Вы можете добавить их в чёрный список: прямо под информацией вашего профиля откройте блок подписчиков, наведите курсор на пользователя и нажмите на появившийся крестик в правом верхнем углу.  ","Подписчики никаких особенных прав не имеют: они видят только те материалы вашей страницы, что видны абсолютно всем пользователям сети. Приватные материалы «только для друзей» им недоступны.Если вы всё же не хотите видеть кого-то в ряду подписчиков, можете добавить их в чёрный список: прямо под информацией вашего профиля откройте блок подписчиков, наведите курсор на пользователя и нажмите на появившийся крестик в правом верхнем углу.  Из чёрного списка его можно удалить минут через 10 — в список подписчиков он в таком случае не вернётся."
простой,Как скрыть семейное положение?,Скрыть «Семейное положение» можно только вместе с основной информацией в профиле.,"Скрыть «Семейное положение» можно только вместе с основной информацией в профиле.Это можно сделать в настройках приватности: https://vk.com/settings?act=privacy, в пункте Кто видит основную информацию моей страницы."
простой,Как удалять сообщения в Мессенджере?,В веб-версии VK Мессенджера нажмите на три точки рядом с сообщением → «Удалить».В мобильном приложении VK Мессенджер удерживайте пальцем нужное сообщение в чате → Нажмите на значок корзины («Удалить»).Удалить сообщения у всех можно в течение суток после отправки. ,В веб-версии VK Мессенджера нажмите на три точки рядом с сообщением → «Удалить».В мобильном приложении VK Мессенджер удерживайте пальцем нужное сообщение в чате → Нажмите на значок корзины («Удалить»).Удалить сообщения у всех можно в течение суток после отправки. На пересланные сообщения удаление оригинала не влияет.
простой,Как поменять настройки для таргетинговой рекламы?,"Чтобы изменить настройки таргетинга, необходимо на уровне рекламного объявления нажать кнопку “Редактировать” и внести изменения в настройки таргетинга. Затем сохранить объявление.","Чтобы изменить настройки таргетинга, необходимо на уровне рекламного объявления нажать кнопку “Редактировать” и внести изменения в настройки таргетинга. Затем сохранить объявление."
простой,Что такое пользовательские жалобы?,"Пользователь может пожаловаться на рекламную запись. После жалобы, запись больше не будет показываться этому пользователя. Оснований для жалобы может быть несколько: 1. Спам. 2. Оскорбление. 3. Материал для взрослых. 4. Пропаганда наркотиков. 5. Детская порнография. 6. Насилие / экстремизм. 7. Призыв к суициду. Вы не сможете получить информацию о том, кто и по какой причине пожаловался на вашу запись - эта опция анонимна. Жалобы рассматриваются модератором, если будет выявлено нарушение правил размещения рекламы, рекламная запись будет отклонена. Если нарушений нет, жалобы никак не повлияют на ход размещения.","Пользователь может пожаловаться на рекламную запись. После жалобы, запись больше не будет показываться этому пользователя.Как это происходит: когда пользователь видит рекламную запись, у него есть возможность [https://vk.com/faq12124|скрыть] её. При скрытии появляется всплывающее окно с кнопкой ПожаловатьсяОснований для жалобы может быть несколько: 1. Спам.2. Оскорбление.3. Материал для взрослых.4. Пропаганда наркотиков.5. Детская порнография.6. Насилие / экстремизм.7. Призыв к суициду.Вы не сможете получить информацию о том, кто и по какой причине пожаловался на вашу запись - эта опция анонимна. Жалобы рассматриваются модератором, если будет выявлено нарушение правил размещения рекламы, рекламная запись будет отклонена. Если нарушений нет, жалобы никак не повлияют на ход размещения.[https://vk.com/faq20656|Что делать, если скрытий и жалоб много?]"
простой,Как изменить правила аудитории?,"Чтобы изменить правило аудитории, нажмите на стрелочку справа от её названия и в выпадающем меню выберите «Редактировать правило».","Чтобы изменить правило аудитории, нажмите на стрелочку справа от её названия и в выпадающем меню выберите «Редактировать правило»."
суммаризация,В чем может быть причина нерабочих пикселей?,"Статус «не работает» у пикселя может означать несколько причин: Пиксель не установлен на сайт или установлен неправильно. Проверьте, правильно ли установлен пиксель на вашем сайте. Убедитесь, что код скопирован полностью и не изменён: вносить изменения в пиксель нельзя.:Код должен быть размещён в верхней части исходного кода сайта между тегами <head> и </head>. У вас уже могут быть другие коды между тегами <head>, поэтому просто поместите код пикселя ВКонтакте ниже других кодов, но выше тега </head>. Пиксель настроен неправильно Убедитесь, что адрес сайта, указанный в настройках пикселя, и сайт, на котором установлен пиксель, совпадают. Сайт давно не посещали Статус «не работает» может также означать, что ваш сайт посещают слишком редко: если на сайте нет посетителей более 24 часов, пиксель будет показывать статус «не работает». Если указанные причины не помогли решить проблему с пикселем, пожалуйста, обратитесь в поддержку ВКонтакте для бизнеса.","Статус «не работает» у пикселя может означать несколько причин: Пиксель не установлен на сайт или установлен неправильно. Проверьте, правильно ли установлен пиксель на вашем сайте. Убедитесь, что код скопирован полностью и не изменён: вносить изменения в пиксель нельзя.:Код должен быть размещён в верхней части исходного кода сайта между тегами <head> и </head>. У вас уже могут быть другие коды между тегами <head>, поэтому просто поместите код пикселя ВКонтакте ниже других кодов, но выше тега </head>. Пиксель настроен неправильно Убедитесь, что адрес сайта, указанный в настройках пикселя, и сайт, на котором установлен пиксель, совпадают. Сайт давно не посещали Статус «не работает» может также означать, что ваш сайт посещают слишком редко: если на сайте нет посетителей более 24 часов, пиксель будет показывать статус «не работает». Если указанные причины не помогли решить проблему с пикселем, пожалуйста, обратитесь в поддержку ВКонтакте для бизнеса."
простой,Как отредактировать пиксель?,"Чтобы отредактировать пиксель, нажмите на стрелочку справа от его названия и в выпадающем меню выберите «Редактировать».","Чтобы отредактировать пиксель, нажмите на стрелочку справа от его названия и в выпадающем меню выберите «Редактировать». При редактировании пикселя все собранные ранее данные не пересчитываются."
простой,Как избежать дополнительных списаний за размещение рекламы?,"Чтобы избежать неожиданных досписаний, рекомендуем проставлять общий лимит рекламного объявления по сумме трат на момент остановки.Например, если объявление потратило 450 р., установите общий лимит этого объявления на 450 р.","Предположим, вы остановили рекламное размещение, но спустя несколько часов или дней в статистике по этому объявлению появились небольшие траты, как будто объявление показывалось после остановки.Почему это происходит?Дело в технических особенностях учёта системой показов и трат. Деньги списываются с баланса вашего рекламного кабинета не за каждый показ, а определёнными порциями — в зависимости от нагрузки на аукцион.Поэтому, когда вы неожиданно для системы останавливаете объявление, она «запоминает» несколько показов, которые получило ваше объявление, но которые вы ещё не успели оплатить. Спустя некоторое время (или при наступлении даты планируемой остановки объявления по таймеру) система понимает, что объявление остановлено окончательно, и списывает долг.Как этого избежать?Чтобы избежать неожиданных досписаний, рекомендуем проставлять общий лимит рекламного объявления по сумме трат на момент остановки.Например, если объявление потратило 450 р., установите общий лимит этого объявления на 450 р."
простой,Как узнать причину отказа размещения рекламного объявления?,"Если одно из ваших объявлений было отклонено, это значит что его показы остановлены. Чтобы запустить рекламу, вам необходимо устранить нарушения: отредактировать объявление или предоставить необходимые документы, которые мы запрашиваем в соответствии с Правилами.","Если одно из ваших объявлений было отклонено, это значит что его показы остановлены. Чтобы запустить рекламу, вам необходимо устранить нарушения: отредактировать объявление или предоставить необходимые документы, которые мы запрашиваем в соответствии с Правилами. [vk.com/faq20698|Как узнать причину отклонения рекламного объявления][vk.com/faq20703|Как настроить уведомления в рекламном кабинете]"
