ТИП,ВОПРОС,ОТВЕТ,КОНТЕКСТ
простой,почему стоит подключить 2fa?,"По данным ВКонтакте, подавляющее большинство взломов случается на аккаунтах с одним фактором защиты — паролем. Это подтверждает, что двухфакторная аутентификация — эффективная мера безопасности профиля. Если в аккаунте включено подтверждение входа, то для авторизации необходимо указать логин, пароль, а также код доступа (это может быть SMS, код из приложения для генерации кодов, push-уведомление на смартфон или звонок-сброс). Даже зная ваши данные для входа, злоумышленник не сможет зайти в профиль без доступа к вашему устройству. Подробнее об этом можно почитать в статье.Включить 2FA можно в разделе Безопасность и вход. Перед подключением защиты убедитесь, что к аккаунту привязан доступный номер телефона и email. Ещё очень важно, чтобы в профиле было указано настоящее имя и фамилия, а также размещены фотографии, по которым можно узнать владельца. При соблюдении всех пунктов двухфакторная аутентификация станет надёжным щитом, оберегающим аккаунт от посторонних.","По данным ВКонтакте, подавляющее большинство взломов случается на аккаунтах с одним фактором защиты — паролем. Это подтверждает, что двухфакторная аутентификация — эффективная мера безопасности профиля. Если в аккаунте включено подтверждение входа, то для авторизации необходимо указать логин, пароль, а также код доступа (это может быть SMS, код из приложения для генерации кодов, push-уведомление на смартфон или звонок-сброс). Даже зная ваши данные для входа, злоумышленник не сможет зайти в профиль без доступа к вашему устройству. Подробнее об этом можно почитать в [https://vk.com/@security-dvuhfaktornaya-autentifikaciya-2fa|статье].Включить 2FA можно в разделе [https://id.vk.ru/account/#/otp-settings|Безопасность и вход]. Перед подключением защиты убедитесь, что к аккаунту привязан доступный номер телефона и email. Ещё очень важно, чтобы в профиле было указано настоящее имя и фамилия, а также размещены фотографии, по которым можно узнать владельца. При соблюдении всех пунктов двухфакторная аутентификация станет надёжным щитом, оберегающим аккаунт от посторонних."
простой,Что такое VKUI?,"VKUI — это открытая библиотека адаптивных React-компонентов. С её помощью вы можете создавать веб-приложения и мини-приложения, интерфейс которых будет выглядеть в стиле ВКонтакте.","VKUI — это открытая библиотека адаптивных React-компонентов. С её помощью вы можете создавать веб-приложения и мини-приложения, интерфейс которых будет выглядеть в стиле ВКонтакте.Полная документация о библиотеке находится по [https://vkcom.github.io/VKUI/|ссылке]."
простой,"Из-за чего в сниппете нет поля ""description""",При публикации внешних ссылок на стене мы подтягиваем с сайтов ключевые данные в предпросмотр: изображение и заголовок. Описание («description») мы в сниппет не забираем.,При публикации внешних ссылок на стене мы подтягиваем с сайтов ключевые данные в предпросмотр: изображение и заголовок. Описание («description») мы в сниппет не забираем.Подробнее о данных сниппета написано в [https://vk.com/dev/publications?f=3.1.%20%D0%94%D0%B0%D0%BD%D0%BD%D1%8B%D0%B5%20%D1%81%D0%BD%D0%B8%D0%BF%D0%BF%D0%B5%D1%82%D0%B0|документации].
простой,Как изменить язык ответа на API запросы?,"Для этого вам следует использовать общий для всех запросов параметр lang. Он определяет язык, на котором будут возвращаться различные данные, например, названия стран и городов. ","Для этого вам следует использовать общий для всех запросов параметр lang.Он определяет язык, на котором будут возвращаться различные данные, например, названия стран и городов. Может содержать строковое обозначение языка или его идентификатор (получить идентификатор языка пользователя вы можете методом account.getInfo).ru (0) — русский,ua (1) — украинский,be (2) — белорусский,en (3) — английский,es (4) — испанский,fi (5) — финский,de (6) — немецкий,it (7) — итальянский.Кириллические имена будут автоматически транслитерированы в латиницу для всех языков, кроме русского, украинского и белорусского."
простой,Как через API указать ссылку на источник?,Для этого нужно указать ссылку в параметре copyright.,Для этого нужно указать ссылку в параметре copyright: https://vk.com/dev/wall.post.Проверить правильность ссылки можно с помощью метода: https://vk.com/dev/wall.checkCopyrightLink.
условный,"С чем может быть связана ошибка ""Internal server error code 10""","Эта ошибка возникает у нас на серверах. Вам стоит чуть-чуть подождать и повторить запрос снова. Если она раз за разом повторяется, нужно связаться с нами.","Эта ошибка возникает на нашей стороне, у нас на серверах. Стоит чуть-чуть подождать и повторить запрос снова. Если она раз за разом повторяется, нужно связаться с нами."
простой,Как загрузить фотографию на аватар через API?,Нужно получить адрес для загрузки фотографии методом photos.getOwnerPhotoUploadServer. Отправить нужный файл POST-запросом на этот сервер Сохранить этот файл методом photos.saveOwnerPhoto,Нужно получить адрес для загрузки документа методом [vk.com/dev/docs.getMessagesUploadServer|docs.getMessagesUploadServer] Отправить нужный файл POST-запросом на этот сервер Сохранить этот файл методом [vk.com/dev/docs.save|docs.save].Подробнее об этом можно прочитать в документации [vk.com/dev/upload_files_2?f=10.%20Загрузка%20документов|тут].
простой,Как создать рекламу?,"Для создания рекламы в ВКонтакте нужно выполнить следующие шаги:
Выберите цель рекламы: Определитесь, что именно вы хотите достичь с помощью рекламы — увеличить узнаваемость продукта, получить больше переходов на сайт или привлечь подписчиков в сообщество.
Выберите формат рекламы: В зависимости от выбранной цели доступны различные форматы объявлений, такие как Универсальная запись, Карусель, Мобильное приложение и другие.
Настройте целевую аудиторию: Определите, кому будет показываться ваше объявление. Вы можете использовать более 20 видов таргетинга, включая пол, возраст, географию, интересы и другие параметры.
Установите расписание и бюджет: Решите, когда и как часто будет показываться ваше объявление. Вы можете настроить время показа и установить дневной и общий бюджет кампании.
Запустите кампанию: После всех настроек можно запустить рекламную кампанию. Не забудьте следить за статистикой и оптимизировать объявления при необходимости.

","Объявление — это основная рекламная публикация ВКонтакте. С её помощью вы можете рассказать о своём бизнесе, привлечь пользователей в сообщество или на мероприятие, собрать заявки на консультацию или продвинуть мобильное приложение. Для каждого объявления вы можете указать собственные настройки: целевую аудиторию, расписание и бюджет.Кампании нужны, чтобы группировать объявления. У них есть несколько преимуществ:1. Удобный поиск. Если у вас много объявлений, можно объединить их по тематике. Так проще будет найти нужное в кабинете.2. Простое управление. Для кампаний доступны [https://vk.com/faq15970|массовые действия]. Вы можете быстро поменять цену, установить лимиты, запустить несколько объявлений одним кликом.3. Ограничение бюджета. Вы можете установить [https://vk.com/faq20602|дневной и общий бюджет] рекламной кампании — это лимит на расходы для всех объявлений в ней.4. Оптимизация бюджета. Это инструмент, который поможет автоматически [https://vk.com/faq19353|распределять выделенный бюджет] между вашими объявлениями таким образом, чтобы получить больше целевых действий.5. Общая статистика. Вы можете посмотреть [https://vk.com/faq20877|суммарную статистику] по всем объявлениям в кампании: сколько всего потрачено, каков CTR или eCPC, сколько показов и переходов получили объявления из вашей кампании и многое другое.Есть техническое ограничение: в одной рекламной кампании не могут быть одновременно объявления разных групп форматов.Выбор цели рекламыЧтобы создать объявление, нужно выбрать цель рекламы. Например, показать объявление наибольшему количеству пользователей и сделать продукт узнаваемым, получить как можно больше переходов на сайт или набрать подписчиков в сообщество.Выбор цели поможет нам публиковать вашу рекламу так, чтобы вы получили лучший результат. Цели делятся на три группы: Показы и переходы, Вовлечение ВКонтакте и Конверсии. Подробнее о целях[[photo100_461656388|400x233pxnoborder| ]]Вы можете отфильтровать цели по объекту, который собираетесь рекламировать. Для этого нажмите на фильтр под заголовком Выберите цель рекламы — в списке останутся только цели, которые подходят вам.[[photo100_461656395|400x243pxnoborder| ]]Выбор форматаФормат рекламы — то, как оформлено ваше объявление. Например, Универсальная запись, Карусель, Мобильное приложение или Запись с кнопкой. Примерный вид объявления вы увидите на картинке слева от названия каждого формата. [https://vk.com/faq20584|Подробнее о форматах].Для разных целей доступны свои рекламные форматы. Для некоторых подходит только один формат — в этом случае он будет выбран автоматически. Если вам кажется, что ни одно из оформлений не подходит, попробуйте изменить цель.[[photo100_461656673|400x216pxnoborder| ]]Настройки целевой аудиторииЧтобы показывать рекламу только тем, кого она может заинтересовать, выберите таргетинги — настройки целевой аудитории. ВКонтакте доступно более 20 видов таргетинга: от самых простых вроде пола, возраста, географии и интересов до тонких настроек. Например, типов устройств, с которых пользователи выходят в сеть. Так вы можете выбрать жительниц Санкт-Петербурга до 30 лет, у которых скоро день рождения и которые часто делают покупки онлайн. [https://vk.com/faq20586|Подробнее о таргетингах ВКонтакте.]Расписание показов рекламы, даты запуска и остановкиЛюди заходят ВКонтакте и днём, и ночью: листают ленту по пути на работу, выкладывают фотографии на обеденном перерыве и смотрят видеоролики перед сном. Чтобы как можно больше пользователей увидели ваши объявления, по умолчанию они работают круглосуточно.Если вы хотите показывать рекламу в конкретные часы и дни, задайте [https://vk.com/faq20634|время показа]. Для этого при создании объявления в разделе Время показа рекламы отметьте ячейки в таблице с расписанием. Вы можете использовать готовые шаблоны: показывать только в рабочее время, только в выходные или выбрать такой же график, как в предыдущем вашем объявлении.Не забудьте про праздничные дни: если стоит галочка Учитывать праздники, то в дни государственных праздников реклама будет показываться так же, как в воскресенья. Если убрать галочку, то система будет считать эти дни обычными.Кроме расписания, вы можете выбрать дату запуска и дату остановки кампании или объявления. Это удобно, например, если вы рекламируете акцию, которая ограничена во времени, или мероприятие с конкретной датой. Можно указать только дату запуска или только дату остановки.Перед установкой даты запуска кампанию или объявление нужно остановить. Если этого не сделать, реклама продолжит работать. Чтобы прервать одну из кампаний, перейдите в их список и нажмите Остановить в поле Статус.То же можно сделать и с объявлением. Найдите в списке кампаний нужную, а затем — само объявление. Кнопка Остановить находится в том же поле Статус.Если вы хотите установить только дату остановки, то менять статус не нужно.Будьте внимательны: при изменении статуса рекламной кампании меняется также статус объявлений внутри неё. Если вы прервёте кампанию, все объявления, запущенные в её рамках, также остановятся. То же касается и запуска — в том числе и по расписанию.Исключение — объявления, которые вы остановили вручную. Если вы поставили их на паузу, затем прервали кампанию, а после запустили её вновь, статус объявлений не изменится. Их нужно будет включить отдельно.Чтобы установить дату запуска или остановки кампании или объявления:1. Перейдите на страницу нужной кампании или объявления.2. Укажите дату запуска и дату остановки. Если вы выберете дату запуска 01.01.2022, а остановки — 31.01.2022, то ваша реклама начнёт транслироваться 01.01.2022 в 00:00, а закончит — 31.01.2022 в 00:01.Даты запуска и остановки можно в любой момент посмотреть на странице кампании или объявления. Если вы передумали, их можно изменить или удалить."
условный,Как сделать страницу с QR-кодом ВКонтакте для государственного сообщества?,"Администраторы сообществ государственных организаций могут создать QR-код в версии для компьютера. В своём сообществе откройте Управление и в блоке Основная информация найдите пункт QR-код. Нажмите на Создать — перед вами появится макет с QR-кодом.Обратите внимание: создать QR-код ВКонтакте можно и другими способами. Чтобы каждый переход по ссылке учитывался в статистике и участвовал в формировании рейтинга государственных сообществ, используйте только способ, описанный выше.","Администраторы сообществ государственных организаций могут создать QR-код в версии для компьютера. В своём сообществе откройте Управление и в блоке Основная информация найдите пункт QR-код. Нажмите на Создать — перед вами появится макет с QR-кодом.Обратите внимание: создать QR-код ВКонтакте можно и другими способами. Чтобы каждый переход по ссылке учитывался в статистике и участвовал в формировании рейтинга государственных сообществ, используйте только способ, описанный выше."
