ТИП,ВОПРОС,ОТВЕТ,КОНТЕКСТ
условный,"Как поступить, если фирма с данным ИНН уже зарегистрирована?","ВКонтакте один ИНН может быть использован только в одном рекламном кабинете.Если при заполнении реквизитов юридического лица вы видите уведомление о том, что такой ИНН уже используется, вам необходимо отправить запрос в поддержку. Кабинет с вашим ИНН будет найден и закрыт, после чего вы сможете использовать реквизиты.","ВКонтакте один ИНН может быть использован только в одном рекламном кабинете.Если при заполнении реквизитов юридического лица вы видите уведомление о том, что такой ИНН уже используется, вам необходимо отправить запрос [https://vk.cc/payhelp|Поддержку]. Кабинет с вашим ИНН будет найден и закрыт, после чего вы сможете использовать реквизиты."
простой,"Что делать, если у меня нет КПП?","Оставьте поле КПП незаполненным, система позволит сохранить реквизиты и без указания КПП.","Оставьте поле КПП незаполненным, система позволит сохранить реквизиты и без указания КПП."
условный,"Что делать, если мой профиль заблокировали?","При входе в заблокированный профиль вы увидите информацию о сроке и причине блокировки, а также о том, как его разблокировать. Вам нужно будет получить код подтверждения на телефон и указать его в соответствующем поле. Если старый номер телефона вам недоступен, укажите при разблокировке новый — он привяжется к вашему профилю. Этот телефон не должен быть закреплён за другим аккаунтом ВКонтакте.Если при разблокировке вы указали новый телефон, спустя 24 часа вам нужно будет выйти из аккаунта и авторизоваться заново, уже с новыми данными. При авторизации укажите новый номер в качестве логина и новый пароль, который придумали во время разблокировки.Если способ разблокировки по номеру не подойдёт, отправьте заявку на восстановление с помощью фотографий по этой ссылке. Вернуться к заявке можно по ссылке из SMS или по адресу.Продолжить пользоваться профилем вы сможете по истечении указанного срока — досрочных разблокировок на платформе нет. Чтобы избежать новых блокировок, соблюдайте рекомендации по безопасности.Если для ваших друзей профиль отображается незаблокированным и дата последней активности не совпадает с вашими последними входами, вероятно, вы случайно попали в старый аккаунт. В случае бессрочной блокировки аккаунта номер телефона блокируется вместе с ним. Создать новый профиль с тем же номером, увы, не получится.Если у вас возникают вопросы или если вы не согласны с блокировкой, напишите в Поддержку — мы детально обсудим вашу проблему.","При входе в заблокированный профиль вы увидите информацию о сроке и причине блокировки, а также о том, как его разблокировать. Вам нужно будет получить код подтверждения на телефон и указать его в соответствующем поле. О возможных причинах отсутствия проверочного SMS от ВКонтакте мы рассказали [https://vk.com/faq19166|здесь].Если <u>старый номер телефона вам недоступен</u>, укажите при разблокировке новый — он привяжется к вашему профилю. Этот телефон не должен быть закреплён за другим аккаунтом ВКонтакте. Если с номером возникли сложности, нажмите [https://vk.com/tutorial?id=phone_number|сюда].Если при разблокировке вы <u>указали новый телефон</u>, спустя 24 часа вам нужно будет выйти из аккаунта и авторизоваться заново, уже с новыми данными. При авторизации укажите новый номер в качестве логина и новый пароль, который придумали во время разблокировки.Если <u>способ разблокировки по номеру не подойдёт</u>, отправьте заявку на восстановление с помощью фотографий по [https://id.vk.com/restore?act=return_page&full=1&mid=240387774&restore_nav=helpdesk&from=helpdesk|этой ссылке]. Вернуться к заявке можно по ссылке из SMS или по адресу vk.com/restore?act=info.<u>Продолжить пользоваться профилем</u> вы сможете по истечении указанного срока — досрочных разблокировок на платформе нет. Чтобы избежать новых блокировок, соблюдайте [https://vk.com/faq18524|рекомендации по безопасности].Если для ваших друзей профиль <u>отображается незаблокированным</u> и дата последней активности не совпадает с вашими последними входами, вероятно, вы случайно попали в старый аккаунт. Такая ситуация возможна, если в ваших профилях совпадают данные для входа. [https://vk.com/faq18062|Сверьте адреса профилей] и смените пароль в одном из аккаунтов при необходимости.<u>При утере доступа</u> к заблокированному профилю воспользуйтесь этой [https://vk.com/faq18515|статьёй]. В случае <u>бессрочной блокировки аккаунта</u> номер телефона блокируется вместе с ним. Создать новый профиль с тем же номером, увы, не получится.Если у вас возникают вопросы или если вы не согласны с блокировкой, напишите в Поддержку — мы детально обсудим вашу проблему.Важно: необходимо создать обращение именно с заблокированного аккаунта. Для этого нужно зайти в профиль через браузер и открыть ссылку: vk.cc/help. Если вы используете мобильное приложение, то надо войти в заблокированный профиль и нажать на кнопку Обратиться в Поддержку (она расположена на экране блокировки и подсвечена синим цветом)."
простой,Как удалить историю платежей?,"Информацию о балансе, историю платежей и переводов голосов удалить не получится. Такую возможность мы не вводим из соображений безопасности.","Информацию о балансе, историю платежей и переводов голосов удалить не получится. Такую возможность мы не вводим из соображений безопасности. Например, если чью-то страницу взломают и переведут с неё голоса, мы это обязательно увидим именно благодаря странице баланса."
условный,"Что делать, если мои данные используются на чужой странице?","Если на чужой странице используются ваше имя, фамилия, фотография или другие данные, напишите нам. Для решения понадобятся следующие данные:1. Ссылка на страницу самозванца2. Описание, что именно украдено (главная фотография, информация, имя)3. Фотография вашего документа (это может быть паспорт, водительские права, БСК, студенческий, ученический, зачетная книжка). Мы понимаем, что не каждый захочет загружать в сеть фотографии личных документов, поэтому важную информацию (например, номер паспорта) можно замазать в графическом редакторе или закрыть листом бумаги. Достаточно, чтобы было видно ФИО, фото и печать 4. Фотография, на которой видно ваше лицо на фоне вашей заявки (т. е. рядом с монитором так, чтобы на нём было видно ваш вопрос)","Если на чужой странице используются ваше имя, фамилия, фотография или другие данные, напишите нам. Для решения понадобятся следующие данные:1. Ссылка на страницу самозванца2. Описание, что именно украдено (главная фотография, информация, имя)3. Фотография вашего документа (это может быть паспорт, водительские права, БСК, студенческий, ученический, зачетная книжка). Мы понимаем, что не каждый захочет загружать в сеть фотографии личных документов, поэтому важную информацию (например, номер паспорта) можно замазать в графическом редакторе или закрыть листом бумаги. Достаточно, чтобы было видно ФИО, фото и печать 4. Фотография, на которой видно ваше лицо на фоне вашей заявки (т. е. рядом с монитором так, чтобы на нём было видно ваш вопрос).Все это нам нужно, чтобы быть уверенными, что к нам обращается истинный владелец этих фотографий."